{
  "workOrderId": "wo-2026-0001",
  "status": "assigned",
  "priority": "normal",
  "assigneeId": "operator-07",
  "statusReason": null,
  "dueFrom": "2026-07-24T01:00:00Z",
  "dueTo": "2026-07-24T09:00:00Z",
  "items": [
    {
      "plotId": "plot-001",
      "cropCycleId": "cycle-001",
      "taskType": "pest_inspection",
      "sourceRequestId": "req-2026-0003"
    },
    {
      "plotId": "plot-002",
      "cropCycleId": "cycle-002",
      "taskType": "manual_watering",
      "sourceRequestId": null
    }
  ],
  "createdAt": "2026-07-23T06:30:00Z"
}
